{
  "$schema": "https://json-schema.org/draft/2020-12/schema",
  "title": "Syntopica data directory configuration",
  "type": "object",
  "additionalProperties": false,
  "properties": {
    "schemaVersion": {
      "type": "integer",
      "minimum": 1
    },
    "instanceId": {
      "type": "string",
      "minLength": 1
    },
    "brain": {
      "type": "object",
      "additionalProperties": false,
      "properties": {
        "pages": {
          "x-path-kind": "required",
          "type": "array",
          "items": {
            "type": "string",
            "minLength": 1,
            "pattern": "^(?!/)(?![\\s\\S]*(?:^|/)\\.\\.(?:/|(?![\\s\\S])))[^\\u0000]+(?![\\s\\S])"
          }
        },
        "sources": {
          "x-path-kind": "required",
          "type": "string",
          "minLength": 1,
          "pattern": "^(?!/)(?![\\s\\S]*(?:^|/)\\.\\.(?:/|(?![\\s\\S])))[^\\u0000]+(?![\\s\\S])"
        },
        "index": {
          "x-path-kind": "required",
          "type": "string",
          "minLength": 1,
          "pattern": "^(?!/)(?![\\s\\S]*(?:^|/)\\.\\.(?:/|(?![\\s\\S])))[^\\u0000]+(?![\\s\\S])"
        },
        "ledger": {
          "x-path-kind": "required",
          "type": "string",
          "minLength": 1,
          "pattern": "^(?!/)(?![\\s\\S]*(?:^|/)\\.\\.(?:/|(?![\\s\\S])))[^\\u0000]+(?![\\s\\S])"
        }
      },
      "required": ["pages", "sources", "index", "ledger"]
    },
    "engines": {
      "type": "object",
      "additionalProperties": false,
      "properties": {
        "brain": {
          "type": "object",
          "additionalProperties": false,
          "properties": {
            "path": {
              "x-path-kind": "required",
              "type": "string",
              "minLength": 1
            },
            "apiVersion": {
              "type": "integer",
              "minimum": 1
            }
          },
          "required": ["path", "apiVersion"]
        },
        "clips": {
          "type": "object",
          "additionalProperties": false,
          "properties": {
            "path": {
              "x-path-kind": "required",
              "type": "string",
              "minLength": 1
            },
            "apiVersion": {
              "type": "integer",
              "minimum": 1
            }
          },
          "required": ["path", "apiVersion"]
        },
        "atrium": {
          "type": "object",
          "additionalProperties": false,
          "properties": {
            "path": {
              "x-path-kind": "required",
              "type": "string",
              "minLength": 1
            },
            "apiVersion": {
              "type": "integer",
              "minimum": 1
            }
          },
          "required": ["path", "apiVersion"]
        },
        "agents": {
          "type": "object",
          "additionalProperties": false,
          "properties": {
            "path": {
              "x-path-kind": "required",
              "type": "string",
              "minLength": 1
            },
            "apiVersion": {
              "type": "integer",
              "minimum": 1
            }
          },
          "required": ["path", "apiVersion"]
        },
        "scribe": {
          "type": "object",
          "additionalProperties": false,
          "properties": {
            "path": {
              "x-path-kind": "required",
              "type": "string",
              "minLength": 1
            },
            "apiVersion": {
              "type": "integer",
              "minimum": 1
            }
          },
          "required": ["path", "apiVersion"]
        }
      },
      "required": ["brain"]
    },
    "clips": {
      "type": "object",
      "additionalProperties": false,
      "properties": {
        "archive": {
          "x-path-kind": "required",
          "type": "string",
          "minLength": 1,
          "pattern": "^(?!/)(?![\\s\\S]*(?:^|/)\\.\\.(?:/|(?![\\s\\S])))[^\\u0000]+(?![\\s\\S])",
          "default": "clips"
        },
        "inbox": {
          "x-path-kind": "state",
          "description": "Checkout of the repository the browser clipper commits to; `clips pull` clones it on first use and hands its pending clips to the archive. Absence is normal until then, and null means this instance has no browser clipper.",
          "type": ["string", "null"],
          "minLength": 1,
          "default": null
        },
        "inboxRepositoryUrl": {
          "description": "Where `clips pull` clones the inbox from.",
          "type": ["string", "null"],
          "minLength": 1,
          "default": null
        },
        "boundaryDecision": {
          "x-path-kind": "required",
          "description": "This instance's boundary decision for model synthesizers. Null means the engine's packaged decision, which refuses.",
          "type": ["string", "null"],
          "minLength": 1,
          "pattern": "^(?!/)(?![\\s\\S]*(?:^|/)\\.\\.(?:/|(?![\\s\\S])))[^\\u0000]+(?![\\s\\S])",
          "default": null
        }
      }
    },
    "atrium": {
      "type": "object",
      "additionalProperties": false,
      "properties": {
        "path": {
          "x-path-kind": "state",
          "description": "Atrium state created by the atrium CLI on demand; absence is normal on a fresh instance.",
          "type": "string",
          "minLength": 1,
          "pattern": "^(?!/)(?![\\s\\S]*(?:^|/)\\.\\.(?:/|(?![\\s\\S])))[^\\u0000]+(?![\\s\\S])",
          "default": "atrium"
        }
      }
    },
    "conversations": {
      "type": "object",
      "additionalProperties": false,
      "properties": {
        "path": {
          "x-path-kind": "state",
          "description": "Canonical conversation archive written by the scribe export; absence is normal on a fresh instance.",
          "type": "string",
          "minLength": 1,
          "pattern": "^(?!/)(?![\\s\\S]*(?:^|/)\\.\\.(?:/|(?![\\s\\S])))[^\\u0000]+(?![\\s\\S])",
          "default": "conversations"
        }
      }
    },
    "capture": {
      "type": "object",
      "additionalProperties": false,
      "properties": {
        "origin": {
          "format": "uri",
          "type": ["string", "null"],
          "pattern": "^https?://(?:[A-Za-z0-9](?:[A-Za-z0-9.-]*[A-Za-z0-9])?|\\[[A-Fa-f0-9:.]+\\])(?::[0-9]+)?/?(?![\\s\\S])",
          "default": null
        },
        "mirror": {
          "type": "boolean",
          "default": false
        },
        "screeningScope": {
          "type": "string",
          "default": ""
        }
      }
    },
    "runners": {
      "type": "object",
      "additionalProperties": false,
      "properties": {
        "synthesis": {
          "type": ["string", "null"],
          "enum": [null, "codex", "agy-fine", "agy-bulk", "cursor", "manual", "fallback", "worker"],
          "default": null
        },
        "grade": {
          "type": ["string", "null"],
          "enum": [null, "codex", "agy-fine", "agy-bulk", "cursor", "manual", "fallback", "worker"],
          "default": null
        },
        "triage": {
          "type": ["string", "null"],
          "enum": [null, "codex", "agy-fine", "agy-bulk", "cursor", "manual", "fallback", "worker"],
          "default": null
        },
        "triageRefiner": {
          "type": ["string", "null"],
          "enum": [null, "codex", "agy-fine", "agy-bulk", "cursor", "manual", "fallback", "off", "worker"],
          "default": null
        }
      }
    },
    "browser": {
      "type": "object",
      "additionalProperties": false,
      "properties": {
        "executable": {
          "type": ["string", "null"],
          "default": null
        }
      }
    },
    "newsletter": {
      "type": "object",
      "additionalProperties": false,
      "properties": {
        "acceptedSenders": {
          "x-path-kind": "required",
          "type": "string",
          "minLength": 1,
          "pattern": "^(?!/)(?![\\s\\S]*(?:^|/)\\.\\.(?:/|(?![\\s\\S])))[^\\u0000]+(?![\\s\\S])",
          "default": ".config/newsletter-accepted.json"
        },
        "rejectedSenders": {
          "x-path-kind": "required",
          "type": "string",
          "minLength": 1,
          "pattern": "^(?!/)(?![\\s\\S]*(?:^|/)\\.\\.(?:/|(?![\\s\\S])))[^\\u0000]+(?![\\s\\S])",
          "default": ".config/newsletter-rejected.json"
        },
        "rejectedBookingSenders": {
          "x-path-kind": "required",
          "type": "string",
          "minLength": 1,
          "pattern": "^(?!/)(?![\\s\\S]*(?:^|/)\\.\\.(?:/|(?![\\s\\S])))[^\\u0000]+(?![\\s\\S])",
          "default": ".config/newsletter-rejected-booking.json"
        },
        "triageProfile": {
          "type": "string",
          "default": ""
        },
        "triageTopics": {
          "type": "array",
          "items": {
            "type": "string",
            "pattern": "^[a-z0-9]+(?:-[a-z0-9]+)*(?![\\s\\S])"
          },
          "default": ["ai-agents", "llm-engineering", "saas", "seo", "devtools"]
        }
      }
    },
    "projects": {
      "type": "object",
      "additionalProperties": false,
      "properties": {
        "roots": {
          "x-path-kind": "required",
          "type": "array",
          "items": {
            "type": "string"
          },
          "default": []
        },
        "aliases": {
          "x-path-kind": "required",
          "type": "string",
          "minLength": 1,
          "pattern": "^(?!/)(?![\\s\\S]*(?:^|/)\\.\\.(?:/|(?![\\s\\S])))[^\\u0000]+(?![\\s\\S])",
          "default": ".config/project-aliases.json"
        }
      }
    },
    "sessions": {
      "type": "object",
      "additionalProperties": false,
      "properties": {
        "desktopRoots": {
          "x-path-kind": "required",
          "type": "array",
          "items": {
            "type": "string",
            "minLength": 1
          },
          "default": []
        }
      }
    }
  },
  "required": ["schemaVersion", "instanceId", "brain", "engines"]
}
